{
  "$schema": "../schemas/environment.schema.json",
  "environment": "development",
  "version": "2.0.0",
  "buildTimestamp": 1736001234567,
  "api": {
    "baseUrl": "https://chat.myrecruiter.ai",
    "timeout": 30000,
    "retries": 1,
    "rateLimit": {
      "requests": 1000,
      "window": 60000
    },
    "headers": {
      "Content-Type": "application/json",
      "Accept": "application/json",
      "X-Environment": "development"
    }
  },
  "cdn": {
    "assetsUrl": "https://picassocode.s3.amazonaws.com",
    "fontsUrl": "https://fonts.googleapis.com",
    "imagesUrl": "https://picassocode.s3.amazonaws.com/images",
    "version": "2.0.0",
    "cacheBusting": false
  },
  "security": {
    "enforceHTTPS": false,
    "allowInsecure": true,
    "corsOrigins": [
      "http://localhost:3000",
      "http://localhost:5173",
      "http://127.0.0.1:3000",
      "http://127.0.0.1:5173",
      "https://chat.myrecruiter.ai"
    ],
    "frameAncestors": [
      "'self'",
      "http://localhost:*",
      "http://127.0.0.1:*"
    ],
    "cookieSettings": {
      "secure": false,
      "sameSite": "lax",
      "httpOnly": true
    }
  },
  "logging": {
    "level": "debug",
    "enableConsole": true,
    "enableRemote": false,
    "sanitizeErrors": false,
    "maxLogSize": 5242880
  },
  "performance": {
    "enableMetrics": true,
    "enableTracing": true,
    "sampleRate": 1.0,
    "metricsEndpoint": "https://chat.myrecruiter.ai/metrics",
    "maxBundleSize": 1048576,
    "lazyLoading": false,
    "cacheStrategy": "memory"
  },
  "features": {
    "streamingEnabled": true,
    "fileUploadsEnabled": true,
    "darkModeEnabled": true,
    "mobileOptimized": true,
    "a11yEnhanced": true,
    "analyticsEnabled": false,
    "errorReportingEnabled": true,
    "performanceMonitoring": true,
    "experimentalFeatures": true
  }
}